title,contents
ENTJ(통솔자) - Conclusion(결론),"['ENTJ(통솔자) - Conclusion(결론)', '결론', '강력한 지성과 전략적 사고로 무장하고 있는 통솔자는 감당하기 어렵다고 여겨지는 장애물을 극복해낼 수 있습니다. 동시에 모든 상황에서 발휘되는 이러한 특성은 많은 오해를 불러일으키기도 합니다. 이런 오해들은 여기서 끝입니다. 당신이 지금까지 읽으신 내용은 단순한 소개일 뿐이며, 우리는 통솔자 유형에 대해서 더 많은 내용을 다루고 있습니다.', ""결과를 다 읽은 시점에서 당신은 전환점에 도달했을 것입니다. 당신은 통솔자에 대한 회의론으로 시작해 '흠...'에서 '어? 진짜야?'로 바뀌었습니다. 가까운 사람에게도 잘 이해받지 못한적이 많았기 때문에 아마 불편해졌을지도 모릅니다."", '이제 당신은 당신이 누구인지를 받아들이고 자랑스럽게 생각하게 되었을지도 모릅니다. 그리고 다른 사람들과의 관계를 단절하는 것은 당신에게 필요하지 않습니다. 이는 잘못된 방어기제에 해당하며 외롭고 효율적이지 못한 길을 걷도록 만들기 때문입니다. 관계를 통해 당신과 타인에 대한 통찰을 얻는 것이 더욱 큰 보람이 있습니다.', '이 결과는 속임수가 아니며 우리가 당신을 관찰하고 있는 것도 아닙니다. 우리는 오랜 시간을 조사하면서 통솔자의 인생, 경험, 패턴을 연구했습니다. 차근차근, 통찰력에 통찰을 더해 당신과 같은 성향을 가진 사람들이 마주한 문제를 어떻게 해결해나가는지 발견했습니다. 당신은 특별한 사람입니다. 하지만 혼자가 아닙니다. 다른 사람의 경험을 통해 배우는 것은 매우 유익하기에 우리는 당신의 통찰을 공유하고 싶습니다.', 'ENTJ(통솔자) - Introduction(소개) 포스팅으로 이동 ▼']"
ENTJ(통솔자) - Workplace habits(직장 습관),"['ENTJ(통솔자) - Workplace habits(직장습관)', '직장습관', '통솔자 유형의 사람들에게 직장은 자연스러운 공간입니다. 통솔자의 효율성과 명료한 의사소통은 높이 평가되며, 리더십은 존경받고, 단순하게 일을 해내는 능력은 추종을 불허합니다. 이들의 능력은 관리자와 감독자의 역할에 어울리며, 상대적으로 그들의 능력을 발휘하기 어려운 낮은 직책에는 어울리지 않습니다.', '통솔자 유형의 사람은 공격적으로 일을 처리하며 어떠한 업무 관계에서도 이에 적응하고 그들이 할 수 있는 최선을 다합니다. 이들은 의견을 제시하며 주도권을 가지고 다른 사람들이 하지 못한다고 하는 일을 달성해냅니다.', '통솔자 직원', '통솔자에게 직원이라는 직책은 하나의 도전입니다. 이들을 만족시키고 참여하도록 만들기 위해서는 적극적인 관리가 필요합니다. 통솔자 직원은 새로운 능력을 발전시키며 열심히 노력한다면 불가능한 것은 없다는 것을 증명하기 위해 새로운 도전을 지속합니다. 통솔자 유형은 업무가 더디게 진행될 경우 슬럼프에 빠지기도 하지만, 그들이 프로젝트에 관여하고 있을 때에는 체계적이고 적극적인 업무자세를 보여줍니다.', '통솔자는 매우 높은 기준을 가지고 있으며, 이러한 기준은 주변 환경으로부터의 피드백, 주로 관리자로부터의 비판에 의해 형성됩니다. 무엇이 더 나은지에 대한 객관적이고 합리적인 비판은 통솔자에게 유익하게 작용하며, 이들은 비판에 분개하기보다는 고마워합니다. 관리자가 통솔자 유형이 생산성을 유지하도록 만드는 것을 주된 책임감으로 인식하고 있다면, 이들의 관계는 만족스러워지며 좋은 결실을 맺을 수 있습니다.', '통솔자 동료', '동료들 사이에서 통솔자는 사교적이며 생각을 나누는 것을 즐깁니다. 타고난 리더인 통솔자는 그들이 가지고 있는 객관성과 카리스마를 통해 자연스럽게 대표 또는 프로젝트의 리더가 되는 경향이 있습니다. 통솔자 유형은 자신과 비슷한 능력을 갖춘 사람과 함께 일하는 것을 즐기므로, 이들의 동료는 자신의 능력을 보여줄 수 있어야 합니다. 통솔자가 능력이 부족하다고 여기는 사람들은 통솔자에게서 겸손한 모습 또는 오만한 모습만 보게될 것입니다.', '통솔자는 강한 의지와 지배적인 성향을 가지고 있어 다른 사람들을 고무시키고 지도하는 것을 즐기지만, 그 과정 속에서 사용되는 에너지는 고압적으로 보일 수 있습니다. 이들의 동료들은 통솔자가 매우 이성적이고 확고한 자신감을 존중한다는 것을 명심해야 합니다. 감정적인 호소, 우유부단한 모습은 그들과의 관계를 망칠 수 있습니다. 파트너십에서 통솔자 유형이 생각하는 최선은 가장 효율적인 것이며, 사탕발림과 같은 행동들은 시간낭비가 될 수 있습니다.', '통솔자 관리자', '통솔자 관리자는 자신 있고 카리스마가 있는 커뮤니케이터입니다. 그리고 그들에게 커뮤니케이션은 최고 수준의 결과를 가능한 효율적으로 만들어내는 수단입니다. 통솔자는 목표를 달성하기 위한 수단과 과정을 다른 사람들로 하여금 자연스럽게 수용하도록 만드는 능력을 가지고 있습니다. 이들은 타고난 리더이며 전략을 수립하고 구성원들의 장점을 파악하는 능력이 있으며, 구성원의 능력을 전체 계획에 적용하여 개인마다 독자적인 역할을 부여하고 그들을 고무시킵니다.', '이러한 노력은 통솔자와 같은 생각을 가지고 있는 직원들의 사기와 만족도를 높이며, 이들은 뛰어난 결과물을 만든다는 최종 목표를 달성하기 위해 계속해서 노력합니다. 통솔자 관리자에게 비효율적으로 여겨지지거나 게으르고 무능력한 모습을 보여준 사람들은 통솔자 관리자의 이목을 끌 수 없습니다. 그들이 이러한 상황을 극복하기 위한 유일한 방법은 순응하고 따르거나 다른 새로운 관리자를 찾는 것 뿐입니다.', 'ENTJ(통솔자) - Conclusion(결론) 포스팅으로 이동 ▼']"
ENTJ(통솔자) - Career Paths(직업/진로),"['ENTJ(통솔자) - Career Paths(직업/진로)', '직업/진로', '통솔자의 대담성과 의욕이 가장 잘 발휘되는 공간은 커리어의 세계입니다. 통솔자 유형처럼 일을 즐기는 사람도 거의 없으며, 통솔자 유형만큼 조직과 팀에서 존경받는 리더는 없기 때문입니다. 장애물을 극복하며 아이디어를 추진해나가는 이들의 안목과 결정은 무시할 수 없는 대단한 힘입니다.', '뛰어난 안목', '삶에서 때로는 개인적 인간관계를 망치는 이들의(특히 공격적인 사람) 오만한 자신감은 오히려 사람들의 업무 수준을 향상시켜 일을 완수시키는 훌륭한 권위로 바뀝니다. 통솔자 유형의 사람은 이러한 자질을 최대한 활용하며, 주로 업무에서 더 넓은 시야를 가지고 있어야 하는 경영자의 위치를 담당하고 있습니다. ', '통솔자에게 실패는 계획에 없습니다. 그들은 미래에 대한 비전을 가지고 목표를 달성하기 위한 전략을 수립하며 이를 하나씩 수행해나갑니다.', '이들에게는 구조화와 질서가 핵심입니다. 그리고 누군가가 무능함, 게으름, 비효율적인 태도로 일을 만들고 있다면, 그들은 떠나는 것을 주저하지 않습니다. 통솔자 유형은 뛰어난 안목을 바탕으로 목표를 추구하고 이를 효율적으로 만들 수 있는 엄격한 기준들을 가지고 있습니다. 이러한 기준들은 통솔자를 뛰어난 기업 전략가로 만들며 이들의 객관성과 명료함은 그들을 존경받는 변호사이자 판사로 만들어줍니다.', '통솔자는 명확하고 간결한 커뮤니케이터로서 비즈니스를 관리하는 것에 재능을 가지고 있습니다. 이들은 또한 지식에 대한 욕구가 강하며, 그들이 배운 이론과 원리를 상황에 적용하는 것을 좋아합니다. 이러한 특징은 이들이 가진 리더십과 결합되어 그들을 효율적인 대학교수로 만들어주기도 합니다.', '큰 기대', '통솔자의 능력이 결과로 나타나기까지 시간이 걸리는 경우가 있습니다. 이것은 그들이 가지고 있는 유일한 문제인데, 낮은 수준의 직원이 통솔자의 기대를 충족하지 못해 떨어져 나가며 정체되는 상황입니다. 통솔자 유형의 사람은 리더십과 책임과, 성장과 기회를 갈망하며, 다른 사람을 관리하며 목표를 달성하는 것을 진심으로 즐깁니다. 통솔자는 으르렁거리는 관리자가 아니라 공상자이자 리더입니다. 결과로 드러나기까지 시간이 걸릴 수도 있겠지만, 결국 목표를 달성할 것입니다.', 'ENTJ(통솔자) - Workplace Habits(직장 습관) 포스팅으로 이동 ▼']"
ENTJ(통솔자) - Parenthood(육아/부모),"['ENTJ(통솔자) - parenthood(육아/부모)', '육아', '부모로서 통솔자는 자녀의 요구와 감정을 받아주기 위해 그들의 강한 의지와, 논리적인 관점을 누그러뜨려야 합니다. 이러한 요구는 그들이 나쁜 부모라는 뜻은 아닙니다. 단지 자녀와의 관계에 있어서 더욱 예민하고 합리적으로 행동하지 못하는 자녀들에게 그들이 일반적으로 주는 자유와 관심보다 더 많은 것을 줘야 한다는 것입니다.', '하지만 통솔자는 언제나 깊은 책임감을 가지고 부모로서의 역할을 진지하게 수행합니다. 통솔자 유형은 자녀의 성공이 그들 개인의 기준에 따라 다르다고 생각하며, 자녀가 목표를 달성하기 위해 노력하는 영리한 사람이 되기를 바랍니다. 이들은 독립적이고 이성적인 사고를 함양하는 것을 도덕적인 가치를 확립하는 것보다 더욱 중요하게 생각합니다.', '감정적 관용 쌓기', '지휘관은 다른 의견을 언제나 환영하며, 이는 자녀에게도 다르지 않습니다. 하지만 자녀와 소통하는 과정에서 그들의 권위가 존중되기를 원합니다. 또한 자녀와의 대화 속에서 발생하는 의견차이는 책임을 회피하는 변명이 될 수 없으며, 통솔자 부모는 이러한 대화 양상을 허락하지 않습니다. 이런 엄격함은 가정 내의 긴장감을 유발할 수 있으며, 약간의 융통성을 가진다면 이를 잘 해결할 수 있습니다.', '자녀와의 대화가 감정적으로 흘러가는 경우 통솔자 부모는 큰 문제에 부딪힙니다. 감정적인 관용 부분에서의 약점은 그들의 자녀의 성장, 특히 청소년기에 큰 장애물로 작용합니다. 다른 관계에서와 마찬가지로 통솔자 부모는 감정적 관용을 쌓기 위해 많은 노력을 해야 합니다. 보통 자녀는 자신의 요구를 이성적으로 잘 표현하지 못하며, 특히 청소년들은 인내심 또한 없기도 하지만, 사실 이건 자연스러운 모습입니다.', '통솔자 부모는 감정적인 표현에 귀기울이고 이에 친절하게 대응함으로써 자녀와의 갈등을 줄일 수 있습니다. 또한 신뢰를 형성해 자녀의 반항심을 누그러뜨릴 수 있습니다.', '독립심 키워주기', '통솔자 부모는 독립심을 기르기 위해서는 자녀가 스스로 자신의 삶을 결정하고 통제할 수 있어야 한다는 것을 기억해야 합니다. 통솔자 부모는 자녀를 위한 노력을 아끼지 않지만, 때로는 마음의 여유를 가지고 자녀를 대하는 것이 유능한 자녀를 키운다는 목표에 강압적인 방식보다 더욱 효과적일 수도 있다는 것을 알아야 합니다.', 'ENTJ(통솔자) - Career Path(직업/진로) 포스팅으로 이동 ▼']"
ENTJ(통솔자) - Friendships(우정),"['ENTJ(통솔자) - Friendships(우정)', '우정', '삶의 다른부분에서와 마찬가지로 통솔자는 우정 속에서 개인적인 성장과 자극을 찾고 이를 달성하기 위한 계획을 가지고 있습니다. 이들은 단순히 일상을 공유하는 것보다 깊고 의미있는 대화를 나눌 수 있는 대상을 찾는 것을 더욱 중요시하며, 배우고 발전하는 사람을 선호합니다. 이런 측면때문에 통솔자의 친구가 되는 것이 쉬운 것은 아니지만, 이들은 그만큼 관계에 많은 관심을 쏟기 때문에, 잘 소원해지지 않습니다.', '통솔자의 우정은 아이디어에 기반을 두고 있으며, 여러 방면에서 발생하는 문제를 재치있게 해결하는 것에 즐거움을 느낍니다. 통솔자 유형의 사람은 매우 똑똑하고 비판적이며, 그들이 수세에 몰리더라도 포기하지 않습니다. 그리고 이러한 모습은 사실 그들의 존경을 받을 수 있는 가장 좋은 방법입니다.', '통솔자와 같이 강한 성격에 대항하는 것은 쉽지 않습니다. 그리고 이들은 종종 다른 사람들을 자신의 영향력 아래에 두는 모습을 보입니다.', '오로지 강한 이성을 가진 사람만이 통솔자에게 대항할 수 있습니다. 바로 이점이 통솔자의 가장 심각한 약점입니다. 감정적인 의견을 배제하고 이성과 논리를 따지는 경향은 감정을 중시하는 친구와의 관계에서 어려움으로 작용합니다. 이런 모습은 어떠한 논리적인 이유가 있을지도 모르지만, 문제를 일으킬수도 있습니다.', '차이 좁히기', '보다 깨어있는 통솔자들은 그들이 다른 사람으로부터 자신을 향상시킬 수 있는 분야가 있다면, 그것은 바로 감정이라는 것을 알고 있습니다. 그래서 직관(N) 특성을 공유하고 있는 외교관 유형과의 우정은 논리와 협력을 통해 더 많은 것을 성취할 수 있습니다.', '통솔자의 친구 대부분은 공통적으로 논리와 토론에 열정을 가지고 있기 때문에 이들은 분석가 유형에 해당할 수 있습니다. 논리적인 생각을 공유하는 사람이라면 누구나 통솔자라는 정직하고 헌신적인 친구를 얻을 수 있습니다. 하지만 통솔자는 토론에 관심을 가지지 않는 사람들에게는 주의를 기울이지 않습니다. 이러한 관계는 당사자 모두에게 더욱 좋은 상황일 것입니다.', 'ENTJ(통솔자) - Parenthood(육아/부모) 포스팅으로 이동 ▼']"
ENTJ(통솔자) - Romantic Relationships(로맨틱한 관계/연애),"['ENTJ(통솔자) - Romantic Relationships(로맨틱한 관계/연애)', '로맨틱한 관계(연애)', '통솔자는 연애나 인간관계에서도 삶의 다른 영역에서와 같이 목표를 설정하며 강렬한 에너지와 열정을 가지고 있습니다. 통솔자 유형의 사람들은 목표를 성취하기 위해 관계에 뛰어들어 상호간에 도움이 되는 관계를 만들기 위해 노력하며, 이 과정을 순탄하게 만드는 것에 책임감을 느낍니다. 통솔자에게 연애는 진지하고 중요한 일이며, 이를 위해 최선을 다해 노력합니다.', '이끄는 성향', '개인의 책임감으로부터 비롯된 이끄는 성향은 통솔자가 관계에 많은 에너지를 쏟도록 만듭니다. 이들은 데이트를 할 때 분위기를 즐겁게 만들고 유지하기 위해 항상 새로운 것들을 준비하는 창의성을 발휘합니다. 하지만 통솔자는 동시에 장기적으로 관계가 어떻게 될지에 대해서도 초점을 맞추고 있습니다. 만약 관계가 안좋은 끝을 향하고 있다면 이들은 사용하는 에너지를 줄일 것이며, 이 경우 상대방은 그동안 받아온 관심이 갑자기 사라진 것처럼 느낄 수 있습니다.', '관계에서의 냉정함은 인간관계에서 통솔자의 주요 약점으로 작용합니다. 하지만 이러한 부분을 조심한다면 다른 사람으로부터의 좋은 평가를 받을 수 있습니다. 다른 사람의 기분과 감정을 살피는 것이 통솔자에게 쉬운 일은 아니지만, 자신과 상대방이 건강하게 감정을 표현하고 소통하기 위해서라면 의식적으로 개발하기 위해 노력해야 합니다. 그렇지 않으면 상대방을 무시하거나 지배하는 형태로 표현될 수 있으며, 특히 초반에 관계를 쉽게 무너뜨릴 위험이 있습니다.', '대담한 사랑', '하지만 데이트가 잘 이루어지고 관계가 미래에도 괜찮을 것으로 여겨진다면, 통솔자 유형의 사람은 계속해서 창의성과 에너지를 사용합니다. 통솔자의 확고한 자신감은 성생활을 역동적으로 만들며, 상상력과 열정을 바탕으로 이들의 애정을 다양한 방식으로 표현하도록 만듭니다.', '통솔자는 매우 성장 지향적이기 때문에 비판에 귀를 기울이며, 스스로를 계발하고 지식을 향상시키기 위해 노력합니다. 동시에 통솔자들은 상대방에게도 이러한 노력을 기대하며, 다른 사람이 이러한 태도를 가지고 있지 않다는 것에 놀랍니다. 이들을 더욱 놀라게 만드는 것은 긴박한 상황을 마주했을 때 이를 회피하려고 하는 모습입니다.', '통솔자들은 그들의 사고와 접근방식이 다양한 해석의 한 단면이라는 것을 기억해야 합니다. 이들은 비판을 효율적으로 바라보지만(그리고 그들의 의견은 주로 옳지만), 상대방은 감정적인 지지를 더욱 중요하게 생각할 수 있다는 것을 명심해야 합니다. 이 부분은 통솔자가 개선해야 하지만, 자주 회피하는 영역이기도 합니다.', '통솔자는 정직한 비판과 꾸준한 감정적 지지의 중간에서 균형을 잡고 상대방을 만나기 위해 노력해야 합니다.', '다른 분석가 유형과 마찬가지로 통솔자는 한 두개의 반대되는 측면을 가지고 있는 다른 직관(N)유형과 잘 맞습니다. 성숙한 통솔자는 이성적인 개인에게도 감정적인 욕구가 충족되어야 한다는 사실을 알고있어 상대방의 요구를 인식하고 맞춰 줄 수 있으며, 회유하고 달래는 것이 관계를 잘 유지하는 최고의 방법이 될 수 있다는 것도 알고 있습니다. 책임감이 강하고 헌신적인 성향을 가진 통솔자 유형은 이러한 사실을 알고 실천함으로써 결과적으로 오래 지속되고 만족스러운 관계를 맺습니다.', 'ENTJ(통솔자) - Friendships(우정) 포스팅으로 이동 ▼']"
ENTJ(통솔자) - Strengths & Weaknesses(강점과 약점/장점과 단점),"['ENTJ(통솔자) - Strengths & Weaknesses(강점과 약점)', '강점과 약점/장점과 단점', '통솔자(ENTJ)의 강점', '효율성', ' : 통솔자는 비효율성을 그 자체의 문제로 보는것 뿐만 아니라, 시간을 끌고 에너지를 낭비하도록 만드는 방해물이자, 불합리함과 게으름이라고 생각합니다. 통솔자 성격의 유형과 함께 하는 사람들은 비효율적인 행동을 하지 않게 됩니다.', '활동적', ' : 계획과 목표를 실행하고 팀을 이끌어가는 것을 진심으로 즐깁니다. 통솔자는 목표를 달성하는 과정을 육체적, 정신적인 부담으로 느끼지 않습니다.', '자기 확신', ' : 자기의심으로 괴로워한다면 통솔자는 일을 할 수 없습니다. 이들은 자신의 능력을 신뢰하고, 의견을 제시하며, 스스로 리더로서의 역량을 믿습니다.', '강한 의지', ' : 통솔자는 힘든 상황이 되더라도 포기하지 않습니다. 이들은 목적을 이루기 위해 노력하며, 결승선까지 도달하는 과정에서 마주하는 장애물에 대응하고 극복하는 것을 즐깁니다.', '전략적 사고', ' : 통솔자는 순간의 위기를 관리하는 것과 다음 단계로 이어지는 과제를 구분합니다. 이들은 문제를 여러 측면으로 다루며, 단기적인 문제를 해결하는 것 뿐만아니라 전체적인 문제를 해결할 수 있도록 이끌어갑니다.', '카리스마와 영감', ' : 통솔자의 특성은 다른 사람들에게 영감을 주고 활기를 불어넣습니다. 다른 사람들은 통솔자가 리더가 되어주기를 원하며, 이러한 점은 통솔자가 혼자 달성하기 힘든 야심찬 목표를 달성하는데 도움을 줍니다.', '통솔자(ENTJ)의 약점', '완고한, 지배적인', ' : 통솔자의 자신감과 의지는 때로 지나쳐 모든 논쟁에서 이기려고 하거나 사람들에게 자신의 비전을 강요하는 모습으로 나타나 스스로를 외롭게 만들기도 합니다.', '너그럽지 않은', ' : -""내가 하자는 대로 하든지, 아니면 말든지""- 통솔자 유형의 사람은 명백한 사실을 추구합니다. 따라서 달성하고자 하는 목적을 방해하는 생각이나 감정적인 의견을 잘 수용하지 않습니다.', '조급한', ' : 세상에는 다른 이들보다 생각할 시간이 더 필요한 사람들도 있지만, 빠르게 생각하는 통솔자는 이를 참기 어려워합니다. 이들은 다른 사람이 심사숙고하는 것을 어리석거나 관심이 없는 것으로 오해하여 리더로서 심각한 실수를 범하기도 합니다.', '오만함', ' : 통솔자 유형은 빠르게 생각하는 것과 스스로의 능력에 자신감을 가지고 있는 것을 존중합니다. 그래서 이에 부합하지 않은 사람들을 무시하기도 합니다. 이러한 성향은 다른 유형의 사람들과의 관계에서 문제를 만들며 고압적인 사람으로 보이도록 만듭니다.', '감정 미숙', ' : 이성주의로부터 나오는 통솔자의 말은 감정에 미숙합니다. 특히 감정적으로 격양된 상황에서 상대방의 마음에 무심코 상처를 주는 경우가 많습니다.', '냉정함, 무자비함', ' : 통솔자의 효율성에 대한 집착과 이성주의에 대한 확고한 믿음은 목표를 추구하는 과정에서 개인의 상황과 감정에 둔감하도록 만들고, 비이성적이고 무관한 것들을 무시하도록 만듭니다.', 'ENTJ(통솔자) - Romantic Relationships(로맨틱한 관계/연애) 포스팅으로 이동 ▼']"
