title,contents
ESFP(연예인) - Conclusion(결론),"['ESFP(연예인) - Conclusion(결론)', '결론', '연예인만큼 매력적이고 마음을 끄는 유형은 거의 없습니다. 즉흥적이며 현재에 완전히 초점을 맞추는 것으로 알려진 연예인들은 즐겁고 새로운 경험과 탐험을 찾는 것에 능숙합니다. 연예인들의 에너지와 열정, 현실적인 태도는 그들 개인의 성장을 포함한 다양한 영역에서 매우 귀중하게 여겨집니다.', '하지만 연예인의 현실에 초점을 맞추는 태도는 때로는 장점보다 단점으로 작용할 수 있습니다. 파트너를 찾고 관계를 유지하거나 경력을 쌓거나 계획으로 나아가는 데 있어서 연예인들은 자신의 약점을 극복하고 보완하기 위해 많은 노력을 해야 합니다.', 'ESFP(연예인) - Introduction(소개) 포스팅으로 이동 ▼']"
ESFP(연예인) - Workplace Habits(직장 습관),"['ESFP(연예인) - Workplace Habits(직장 습관)', '직장 습관', '연예인은 직장에서 어느 위치에 있든지 가능한 업무환경을 즐겁고 친근하게 만들기를 바랍니다. 연예인 유형의 사람들은 사교적이고 편안한 태도를 가지고 있으며, 다른 사람들이 실용적으로 일을 처리할 수 있도록 만들어줍니다. 연예인들이 목표를 정확하게 알고 있는 상황에서 이들에게 주어진 자유는 결과를 더 좋은 방향으로 만듭니다. 역동적이며 바쁜 업무 환경 속에서 이들보다 더 좋은 성격 유형은 거의 없습니다.', '연예인 직원', '직원으로서 연예인은 새로운 아이디어와 변화를 좋아하며 반복되고 정해진 업무를 싫어합니다. 연예인 유형의 사람들은 그들의 창조성을 재량으로 적용할 수 있다면 빠르게 새로운 방법을 찾고 이를 실용화할 수 있는 의욕적이고 유능한 직원입니다. 하지만 빠른 결과를 얻기 위해 노력하는 과정에서 더 많은 일들에 휘말리기도 합니다.', '연예인들은 일에 대해 정직하고 솔직하며,  이들의 모습에 대한 다른 사람들의 비판에 민감합니다. 공격받는 상황 속에서 이들은 방어적이고 다혈질적인 모습을 보여줍니다. 하지만 그 비판이 도움을 주고자 하는 마음에서 나온다고 믿는 경우에는 상처를 받지 않고 진심으로 받아들입니다. 연예인들은 안전보다는 자유와 독립성에 가치를 두기 때문에 이러한 조건이 맞지 않는다면 떠날 가능성이 높습니다.', '연예인 동료', '동료들과 친구가 되고 팀에서 긴장감을 해소시켜줄 수 있는 사람이 있다면, 아마 연예인일 것입니다. 연예인 유형의 사람들은 즐거운 분위기를 중요하게 생각하고 그들의 관찰력과 사회성을 발휘하여 안 좋은 분위기를 좋게 만들 수 있습니다. 연예인들은 직장 안과 밖에서 즐거운 이벤트와 활동을 기획하는 것을 좋아하며 이들은 매우 자발적이며, 재치 있고 열정적인 사람들입니다.', '연예인 관리자', '관리자로서 연예인들은 매일매일 해야 하는 일들을 즐겁게 만들기 위해 그들의 모든 에너지를 사용합니다. 연예인 유형의 사람들은 관심받는 것을 좋아하며 그들 자신이 필요하고 인정받는다는 느낌을 특히 더 좋아합니다. 이들은 업무에 뛰어들어 직원들이 필요로 하는 것을 도와주는 것을 일의 일부라고 생각하며, 권위와 사회적인 지위는 팀이 일을 해내는 데 있어 가장 중요한 것이 아니라고 생각합니다.', '연예인들은 다른 사람들의 감정을 잘 알아챕니다. 그리고 이들처럼 갈등을 예방하면서 편안하게 업무 공간을 즐길 수 있도록 만들어줄 수 있는 유형은 별로 없습니다. 직원들은 문제가 생겼을 때 자신의 생각을 편하게 말할 수 있으며, 이 유형의 사람들은 이러한 말을 듣는 것을 좋게 생각합니다. 다른 사람들을 편하게 만들어주고 스스로 생각하도록 만들어주는 연예인들의 능력은 그들 자신을 여유가 넘치고 고무적인 리더로 만들어줍니다.', 'ESFP(연예인) - Conclusion(결론) 포스팅으로 이동 ▼']"
ESFP(연예인) - Career Paths(직업/진로),"['ESFP(연예인) - Career Paths(직업/진로)', '직업(진로)', '연예인이 가지고 있는 성향은 특정 직업에서 매우 특출난 모습을 보이도록 만들지만, 그 외 분야에서는 두각을 드러내기 어렵습니다. 이들은 주변의 분위기를 그대로 반영하기 때문입니다. 연예인 유형의 사람들이 파티나 콘서트에 있는 경우라면 이들은 파티를 즐기는 사람의 모습을 보여주지만, 반대로 친구가 슬픈 상황이라면 이들은 동정과 공감으로 슬픈 모습을 그대로 드러냅니다. 또한 이들은 위기가 발생할 때 상황에 맞추어 잘 적응하고 행동합니다.', '새로운 과제 찾기', '결과적으로 연예인은 어떤 직업이든 다른 사람과 함께하는 일이라면 잘 맞습니다. 그리고 행복과 생산성을 위해서는 필수적입니다. 연예인 유형은 타고난 이벤트 기획자, 영업 담당자, 여행 기획자, 가이드로서 그들과 고객 사이에서 즐거움과 자극, 참신함을 만들어냅니다.', '연예인은 감성적인 감수성과 자립심, 지혜의 조화를 통해 독특한 경험을 만들어냅니다.', '연예인들은 진심으로 다른 사람들과 서로를 알아가고 시간을 보내는 것을 즐기며, 스트레스 받는 상황 속에서도 다른 사람을 행복하게 만드는 것에 재능이 있습니다. 연예인 유형은 도전을 즐기며 직원 또는 고객의 만족을 높이는 상담사, 사회복지사, 코치, 컨설턴트입니다.', '연예인은 도움이 매우 필요할 때 기지와 열정을 가지고 대응하는 능력으로 응급구조사, 구급 대원, 간호사와 같은 뛰어난 의료 전문가가 될 수 있습니다. 이들은 아프거나 다친 환자를 다룰 때 정보를 빠르게 이해하고 핵심을 처리할 수 있는 능력을 갖추고 있습니다. 연예인들의 강렬한 감정을 잘 다룰 수 있는 영역입니다.', '하지만 모두가 그러한 에너지와 삶과 죽음에 대한 책임감을 가지고 싶어 하지는 않습니다. 어떤 사람들은 아름다움을 통해 사람들을 즐겁고 행복하게 만드는 것을 선호하기 때문입니다. 이러한 유형의 사람들은 창조적인 에너지가 풍부하여 음악, 패션, 사진, 인테리어 디자인 등에서 좋은 경력을 쌓는 경우가 많습니다. 연예인은 스타일 감각으로 유명하며, 어느 다른 유형보다도 미적인 감각을 가지고 있습니다.', '약간의 혼란', '연예인은 사람들과의 접촉이 없고 데이터 중심의 업무를 수행하는 것에 고통을 느낍니다. 동료들과 의기투합하여 일을 잘 처리하는 연예인들도 있지만, 대부분의 경우 기술적인 글쓰기나 데이터 분석과 같은 일은 이들에게 적합하지 않습니다. 여기에 이들이 싫어하는 일정과 구조화, 반복과 9시부터 5시까지 일하는 환경까지 더해진다면 연예인은 일을 거부할 것입니다.', '이들의 다양한 열정이 어디를 향하고 있든지에 관계없이 연예인들은 자유와 참신함, 무엇보다도 사람과의 접촉이 필요합니다. 연예인 유형의 사람들은 자신의 진가를 사람들이 알아보지 못하더라도 그들이 자신을 좋아한다는 것을 알아야 합니다. 연예인들은 일을 할 때, 약간의 혼란을 원합니다. 그리고 같은 편에 있는 유능한 동료들과 함께 이를 해결하고 싶어 합니다.', 'ESFP(연예인) - Workplace Habits(직장 습관) 포스팅으로 이동 ▼']"
ESFP(연예인) - Parenthood(육아/부모),"['ESFP(연예인) - Parenthood(육아/부모)', '육아(부모)', '연예인은 가장 편안하고 즐거운 것을 좋아하는 부모입니다. 이들은 자녀들과 함께 노는 것을 좋아하며, 연예인 유형의 사람들은 자녀들과 함께 즐거운 시간을 보낼 수 있는 방법을 고안합니다. 연예인은 처음 아이를 안는 순간부터 아이들과 함께하는 경험에서 즐거움을 느끼며 최대한 이들을 격려하기 위해 노력합니다.', '자유롭게 키우는', '탐험과 경험은 연예인 유형에게 핵심적인 철학입니다. 자녀들이 질문을 하면 이들은 ""찾아보자!""고 대답합니다. 고압적이거나 빽빽한 일정의 활동은 연예인 유형의 부모에게 중요한 부분이 아닙니다. 이들은 아이들이 감사함을 느낄 수 있는 새로운 것들을 찾으며 경험하는 것을 선호합니다.', '물론 이러한 점이 연예인들에게 아무런 규칙이 없다는 뜻은 아닙니다.', '규율은 이들과는 거리가 멀지만, 연예인들은 성숙하면서 아이들이 그들이 살아오면서 느꼈던 같은 아픔을 겪지 않도록 하기 위해 노력합니다. 그래서 연예인 유형의 사람들은 자녀들이 사회의 규칙을 고려하고 존중하기를 바랍니다. ', '연예인들은 언제나 자녀들에게 충분한 감정적인 지원을 제공하기 위해 노력합니다. 이들의 따뜻한 애정과 실용성은 자녀들과의 차이를 메우며 매우 양육적이며 격려하는 육아 스타일을 가지고 있습니다. 이들의 자녀들이 미래 우주인이 되겠다고 말한다면, 연예인들은 그 말을 믿어주고 자녀들이 이 목표를 달성하기 위해 학업에 집중할 수 있도록 도와줍니다.', 'ESFP(연예인) - Career Paths(직업/진로) 포스팅으로 이동 ▼']"
ESFP(연예인) - Friendships(우정),"['ESFP(연예인) - Friendships(우정)', '우정', '연예인은 엄청나게 사교적이고 즐겁게 살아가는 태도를 가지고 있습니다. 그들은 어떠한 일에 대해 마음 속에 담아두기 보다는 재치와 열정을 가지고 친구들과 함께 공유합니다. 연예인은 삶의 즐거움을 찾으며 다른 사람들과 공유하는 것에 즐거움을 느낍니다. 연예인에게 살아있다는 느낌은 곧 삶의 이유입니다.', '즐거운 인생', '연예인은 행동하는 사람입니다. 이들은 오감을 자극하는 행동을 좋아합니다. 하지만 때로는 이들은 너무 지나쳐 위험하고 부주의한 행동을 하면서 다른 사람을 끌어들이기도 합니다. 이 유형의 사람들은 섬세하므로 다른 사람이 이러한 즐거움을 거절하는 경우 이를 개인적으로 받아들여 관계가 끝나게 되는 경우도 있습니다. 그들은 거절이나 조언을 듣고 싶어하지 않습니다.', '하지만 연예인들에게 새로운 친구를 사귀는 것은 어렵지 않습니다. 그들은 직설적인 말과 함께 열린 마음과 매력을 조합하여 마음을 끌어당깁니다. 오히려 이들에게 어려운 것은 기존의 친구들과 관계를 유지하는 것입니다. 연예인은 쉽게 한 사람에 대한 즐거움을 소진하고 새로움이 사라지면 다른 사람을 찾기 때문입니다.', '이러한 점은 연예인이 다른 사람을 신경쓰지 않는 쾌락주의적인 사람으로 보이게 만들 수 있습니다. 이것은 심각한 오해이며 사실과는 다르지만, 직관(N) 유형의 사람과 우정을 만드는 것은 어려울 수 있습니다. 연예인 유형은 모두가 즐길 수 있는 활동에 에너지를 쏟으며 진심으로 친구들을 아낍니다. 그리고 그들은 관계 속에서 갈등을 느끼는 것에 크게 마음아파합니다.', '연예인들은 성숙하면서 다른 유형의 사람을 존중하게 되고 더욱 가까워질 수 있습니다.', '참신함은 연예인 유형의 사람들에게 매우 중요하며, 그들 주변에 있는 친구들 또한 다양성을 지니고 있습니다. 연예인은 지적이고 철학적인 주제에 관심을 가지며, 친구들의 다양한 성격과 관점을 찾고 이해합니다. 친구들이 유럽 경제위기로 인한 고민을 하고 있다면, 이들은 그들의 마음이 방황하고 있다는 것을 깨닫고 말을 걸어줍니다.', 'ESFP(연예인) - Parenthood(육아/부모) 포스팅으로 이동 ▼']"
ESFP(연예인) - Romantic Relationships(로맨틱한 관계/연애),"['ESFP(연예인) - Romantic Relationships(로맨틱한 관계/연애)', '로맨틱한 관계(연애)', '연예인은 사회적이고 즐거우며, 자유분방합니다. 살아가는 매 순간에 흥미를 느끼며 살아가는 이들은 연애에 있어서도 항상 새롭고 에너지가 넘치는 모습을 보여줍니다. 연예인 유형의 사람들에게 관계는 미래를 위해 천천히 쌓아가는 것이 아니라 즐거움이 가득한 예측할 수 없는 거품과 같은 것입니다.', '사랑의 불꽃', '물론 그 즐거움이 사라지고 나면, 관계는 끝입니다. 연예인들은 현재의 사랑과 헌신에 관계없이 그들의 상황을 지속적으로 재평가합니다. 만약 일주일 뒤에 같은 마음이라는 생각이 들지 않는다면, 연예인 유형은 관계를 끊는 것에 거리낌이 없습니다. 관계를 끊는 것보다 더 나은 방법이 있을 수도 있지만, 그들이 이러한 가치를 깨닫기 위해서는 많은 경험과 성숙함이 필요합니다.', '연예인과의 관계는 쉽게 잊히지 않습니다. 이 유형의 사람들은 항상 새롭고 즐거운 활동을 하며 파트너와 함께 시간을 보내는 것을 즐깁니다. 연예인은 육체적인 친밀함을 매우 즐기며 애정이 넘치고 호기심이 많으며 서로 도움을 주고받을 수 있는 파트너에게 개방적인 모습을 보여줍니다.', '연예인과의 대화는 깊게 서로를 알아가는 것보다 즐겁고 독특한 주제에 초점이 맞추어져 있습니다. 과거와 미래, 과학과 정치, 장기적인 계획과 노력에 대해 연예인 유형은 관심이 없습니다. 이러한 주제들은 연예인의 라이프 스타일을 무겁고 느리게 만듭니다.', '연예인은 누구든, 무엇이든 관계없이 즐겁게 이야기하며 주제를 강요하지는 않습니다.', '매우 감정적이고 섬세한 연예인들은 자신의 연애에 대한 외부의 ""의견""에 불쾌한 반응을 보입니다. 파트너로부터의 비판일 경우 이들은 더욱 기분이 상하며, ""개인적인 문제로 받아들이지 마""라고 말하더라도 도움이 되지 않습니다. 이러한 상황을 적절하게 다루는 것은 연예인들에게 분명한 개선의 영역입니다. 연예인들의 이러한 특성을 의도적으로 이용하는 관계를 형성하는 사람도 있기 때문입니다.', '비판이 없다는 것은 오히려 문제가 될 수 있습니다. 연예인들은 사교적인 활동에 많은 에너지를 쏟으며 연인과 친구들에게도 많은 영향을 받기 때문입니다. 연예인들은 친구든 연인이든 비슷한 태도를 공유하는 사람들에게 흥미를 느끼기 때문에 성숙하지 못한 채 서로 듣고 싶은 말만 주고받는 상황에 빠지게 될 수도 있습니다.', '즐거운 마음', '이러한 모든 경향들은 나중에 연예인 유형의 사람들을 괴롭힐 수 있습니다. 약속을 깨거나 교제 상대를 자주 바꾸는 경향은 은퇴 계획과 같이 필요한 장기적인 목표를 방해하기 때문입니다. 진정한 관계를 형성하기 위해서는 많은 시간과 의식적인 노력이 필요합니다.', '연예인은 삶의 작은 기쁨을 느끼며 파트너와의 차이점을 인정하는 매력적인 사람입니다. 열정적이며 애정이 넘치고 파트너를 있는 그대로 받아들이는 순수한 사랑을 가지고 있는 연예인들은 행복보다 안정을 택하기보다는 매일매일 함께할 수 있는 사람을 찾기 위해 노력합니다.', 'ESFP(연예인) - Frirendships(우정) 포스팅으로 이동 ▼']"
ESFP(연예인) - Strengths & Weaknesses(강점과 약점/장점과 단점),"['ESFP(연예인) - Strengths & Weaknesses(강점과 약점/장점과 단점)', '강점과 약점(장점과 단점)', '연예인(ESFP)의 강점(장점)', '대담함', ' : 연예인들은 망설이는 것이 없습니다. 연예인 유형의 사람들은 주변의 모든 것을 경험하고 싶어 하기 때문에 다른 사람이 내키지 않아 하더라도 해보는 것을 신경 쓰지 않습니다.', '새로운', ' : 전통과 기대는 연예인들에게 중요하지 않습니다. 연예인 유형은 새로운 스타일을 시도하며 관중들 사이에서 눈에 띌 수 있는 새로운 방법을 찾습니다.', '이목을 끌고 즐겁게 만드는 능력', ' : 단순히 복장뿐만 아니라 연예인들은 그들의 말과 행동에도 예술적인 창의성을 부여합니다. 이들은 매일이 퍼포먼스이고 사람들에게 보여주는 것을 좋아합니다.', '실질적인 ', ': 연예인들에게 세상은 느끼고 체험하는 것입니다. 이들은 허구에 익숙하지 않습니다. ""만약에"" 대해 철학적으로 고민하기보다는 직접 보고 하는 것을 선호합니다.', '관찰력 있는', ' : 이들은 현재에 초점을 맞추며 행동합니다. 그래서 연예인 유형은 실질적이고 만질 수 있는 것들을 인지하는 것이 자연스럽습니다.', '뛰어난 대인관계', ' : 연예인 유형은 무엇보다도 사람들에게 관심을 가지고 있습니다. 그들은 수다스럽고, 재치 있고, 대화의 소재가 끊이지 않습니다. 이 유형의 사람들에게 행복과 만족은 함께 하며 시간을 보내는 것에서 생겨납니다.', '연예인(ESFP)의 약점(단점)', '예민한', ' : 연예인 유형은 매우 감정적이며 비판에 취약합니다. 그들은 스스로가 궁지에 몰리는 상황에서 잘못된 반응과 행동으로 나올 수 있습니다. 이러한 성향은 특정 상황에서 적절하게 대응하지 못하도록 만들기 때문에 연예인의 가장 큰 약점으로 작용합니다.', '갈등을 회피하는', ' : 연예인들은 때때로 갈등을 완전히 회피하려는 모습을 보입니다. 이들은 갈등 상황에서 벗어나  즐거운 것들만 하려는 경향이 있습니다.', '쉽게 질려 하는', ' : 지속적으로 흥미가 끌리지 않는 상황에서 연예인은 스스로 새로운 흥미를 찾기 위해 노력합니다. 위험하며 제멋대로인 행동을 하고 장기적이기보다는 순간적인 만족에 빠지는 경우가 많습니다.', '장기적인 안목 부족', ' : 사실 연예인 유형은 미래에 대한 세부적인 계획을 잘 세우지 못합니다. 이들은 언제든지 상황은 바뀔 수 있다고 생각하기 때문에, 계획이 필요한 상황에서도 과정과 절차에 대해 관심을 가지지 않습니다.', '집중력이 약한', ' : 장기적인 노력과 관심이 요구되는 것들은 연예인 유형에게는 특별한 도전입니다. 이들은 고전문학과 같이 빡빡하고 고정적인 것들에 대해 어려움을 느낍니다. 연예인 유형은 더 넓고 큰 목표를 가지고 매일의 지루한 것들을 극복할 수 있어야 합니다.', 'ESFP(연예인) - Romantic Relationships(로맨틱한 관계/연애) 포스팅으로 이동 ▼']"
ESFP(연예인) - Introduction(소개),"['ESFP(연예인) - Introduction(소개)', '성격유형 : ""연예인""', '주저하지 말고 매 순간을 즐겨라.', '엘튼 존', '연예인(ESFP)은 즉흥적으로 노래하고 춤을 추는 일을 즐기는 성격입니다. 이들은 지금 이 순간을 즐기며 남들도 자신과 같은 즐거움을 느낄 수 있기를 바랍니다. 또한 남을 응원하는 데 기꺼이 시간과 에너지를 투자하며, 매우 매력적인 방식으로 다른 사람의 기운을 북돋곧 합니다.', '열정적인 삶', '연예인은 다른 사람의 관심을 즐기며 세상을 하나의 무대로 생각합니다. 연예인 성격을 지닌 사람은 배우로 일하는 경우가 많으며, 친구와 외출할 때는 파티처럼 즐거운 분위기를 유지하는 역할을 합니다. 이들은 매우 사교적인 성격으로 사소한 일도 즐거워하며 친구들과 재미있는 시간을 보내는 일에서 큰 만족감을 느낍니다.', '또한 연예인은 미적 감각과 패션 감각이 매우 뛰어난 성격으로 자신과 집을 멋지게 꾸미는 일에도 소질이 있습니다. 이들은 매력적인 물건을 한눈에 알아보며 자신의 스타일에 맞게 주변을 변화시키곤 합니다. 또한 선천적으로 호기심이 많은 성격이기에 자유롭게 새로운 디자인과 스타일을 시도해 보기도 ㅎ바니다.', '연예인이 자신에만 집중하는 것처럼 보일 수도 있지만, 사실을 관찰력이 뛰어나며 빠르게 다른 사람의 감정을 알아차리는 성격입니다. 이들은 다른 사람이 자신의 문제에 대해 이야기할 수 있도록 돕고, 다른 사람의 문제에 공감하며 실질적인 조언을 제공하곤 합니다. 그러나 다른 사람과 갈등이 발생하면 문제를 해결하기보다는 아예 소통을 거부하기도 합니다. 또한 열정과 즐거움을 추구하며 다른 사람의 비판을 받는 일은 달가워하지 않습니다.', '즉흥적인 즐거움 추구', '연예인이 겪을 수 있는 가장 큰 문제는 즉흥적인 즐거움을 추구하는 과정에서 의무와 책임을 무시할 수 있다는 것입니다. 또한 복잡한 분석이나 반복적인 작업이나 통계치를 실제 결과에 대입하는 일 등에는 큰 소질이 없습니다. 이들은 보통 행운이나 우연한 기회에 의존하거나 친구들에게서 도움을 받곤 합니다. 그러나 은퇴 계획이나 건강 관리 등의 장기적인 계획은 스스로 챙길 수 있도록 노력하는 것이 중요합니다.', '연예인은 물건의 가치와 품질을 파악하는 데 뛰어난 소질을 지니고 있습니다. 그러나 계획성이 부족한 편이기 때문에 신용 카드를 과다하게 사용하는 등 사치에 빠지게 될 가능성이 있습니다. 또한 장기적인 목표를 수립하기보다는 새로운 기회를 발견하는 데 집중하느라 주의가 산만해질 때가 있습니다.', '연예인은 원할 때 친구와 함께 할 수 없는 경우 슬픔을 느낍니다.', '연예인은 주변 사람을 웃게 하고 활기를 북돋우며 새롭고 즐거운 일을 시도합니다. 또한 모든 사람을 즐겁게 할 때 큰 행복감을 느낍니다. 이들은 오랫동안 이야기하는 일을 즐기며 사랑하는 사람과 즐거움과 슬픔을 함께 나누곤 합니다. 일의 우선순위를 적절히 정할 수만 있다면 친구와 함께 신나고 참신한 일을 언제든지 걱정 없이 즐길 수 있을 것입니다.', '연예인형에 속하는 유명인', 'Elton John : 영국 싱어송라이터', 'Marilyn Monroe : 미국 배우', 'Jamie Oliver : 영국 요리사', 'Adele : 영국 싱어송라이터', 'Jamie Foxx : 미국 배우', 'Steve Irwin : 오스트레일리아 환경운동가', 'Miley Cyrus : 미국 배우', 'Adam Levine : 미국 싱어송라이터', '극중 인물', ""Dandelion : 드라마 '위쳐' 단델라이언"", ""Ygritte : 드라마 '왕자의 게임' 이그리트"", ""Penny : 드라마 '빅뱅이론 ' 페니"", ""Captain Marvel : 영화 '캡틴마블' 캡틴마블"", ""Angela Montenegro : 드라마 '본즈' 안젤라"", ""Peregrin Took : 소설 '반지의 제왕' 페레그린"", ""Gob Bluth : 드라마 '못말리는 패밀리' 곱 블루스"", ""Lindsay Bluth Funke : 드라마 '못말리는 패밀리' 린제이"", ""Jack Dawson : 영화 '타이타닉' 잭 도슨"", 'ESFP(연예인) - Strengths & Weaknesses(강점과 약점/장점과 단점) 포스팅으로 이동 ▼']"
